{
  "$contract": "soter://contracts/configuration/v1",
  "contractVersion": "1.0.0",
  "name": "process-red-team",
  "base": { "kernel": "kernel.soter", "core": "core.runtime" },
  "packs": [
    { "id": "context.process", "source": "dependency", "reason": "Process Red Team depends on portable process, run, policy, schema-source, lens, severity, and report-only meaning." },
    { "id": "automation.process-red-team", "source": "user", "reason": "The user selected a five-lens, exact-source, read-only process review." },
    { "id": "integration.notion", "source": "binding", "reason": "The selected review definition, target process, policies, schema, and run live in configured Notion targets." }
  ],
  "bindings": [
    { "capability": "process.records.read", "providerPack": "integration.notion", "authorities": ["authority.process.definition", "authority.process.instance"], "secretRef": "secret-ref.notion", "reason": "Notion supplies the exact review policy selection and bounded review source set." },
    { "capability": "process.schema.read", "providerPack": "integration.notion", "authorities": ["authority.process.instance"], "secretRef": "secret-ref.notion", "reason": "Notion supplies one current normalized schema observation for the declared write target." }
  ],
  "sources": [
    {
      "id": "source.policy.process-review",
      "capability": "process.records.read",
      "authority": "authority.process.definition",
      "input": { "recordTypes": ["process-review-policy"], "ids": ["policy.process-review"], "limit": 2 },
      "readiness": { "mode": "probe-read", "reason": "Connected readiness must prove the selected review policy record can be read without retaining private values." },
      "consumers": [
        { "pack": "automation.process-red-team", "purpose": "process-review-policy", "subjects": ["process-review"], "reason": "The exact external selection binds the governed lenses and report-only rules used by preparation." }
      ],
      "reason": "Process review rules are a selected Context definition rather than Automation-owned constants."
    }
  ],
  "authorities": [
    { "id": "authority.process.definition", "role": "definition", "subject": "process.records", "uri": "soter-fixture://configuration-template/notion/authority/process-policies", "reason": "The selected policy record identifies the governed process-review definition." },
    { "id": "authority.process.instance", "role": "instance", "subject": "process.records", "uri": "soter-fixture://configuration-template/notion/authority/process", "reason": "The configured Process records and schemas own exact review source observations." },
    { "id": "authority.notion.provider", "role": "provider", "subject": "notion.workspace", "uri": "soter-fixture://configuration-template/notion/account/operator", "reason": "The selected Notion account supplies provider identity and permission context without becoming domain authority." },
    { "id": "authority.run.evidence", "role": "evidence", "subject": "runtime.runs", "uri": "soter-state://runs", "reason": "Private local runtime state owns prepared work and review companions." }
  ],
  "effectPolicies": {
    "read": { "mode": "allow", "reason": "The selected review definition and bounded exact source set may be read for private preparation." },
    "disclosure": { "mode": "allow", "reason": "Selected observations may enter a private run envelope with explicit minimization." },
    "write": { "mode": "confirm", "reason": "The shared selected Notion pack declares write capabilities, but Process Red Team requires none, emits no proposed change, and declares no compiler or execution path." },
    "dispatch": { "mode": "prohibit", "reason": "Process Red Team does not dispatch agents, messages, or work in this contained migration slice." },
    "destructive": { "mode": "prohibit", "reason": "Process Red Team never deletes or performs destructive changes." }
  },
  "secretRefs": [{ "id": "secret-ref.notion", "provider": "host", "key": "NOTION_OAUTH" }],
  "host": { "id": "codex", "adapter": "host.codex", "version": "0.3.1", "reason": "This contained configuration exercises Codex projection while preserving provider-neutral contracts." },
  "settings": {
    "integration.notion": {
      "targets": {
        "policies": "soter-fixture://configuration-template/notion/collection/policies",
        "organizations": "soter-fixture://configuration-template/notion/collection/organizations",
        "contacts": "soter-fixture://configuration-template/notion/collection/contacts",
        "projects": "soter-fixture://configuration-template/notion/collection/projects",
        "updates": "soter-fixture://configuration-template/notion/collection/updates",
        "tasks": "soter-fixture://configuration-template/notion/collection/tasks",
        "meetings": "soter-fixture://configuration-template/notion/collection/meetings",
        "documents": "soter-fixture://configuration-template/notion/collection/documents",
        "process-policies": "soter-fixture://configuration-template/notion/collection/process-policies",
        "processes": "soter-fixture://configuration-template/notion/collection/processes",
        "roles": "soter-fixture://configuration-template/notion/collection/roles",
        "services": "soter-fixture://configuration-template/notion/collection/services",
        "process-runs": "soter-fixture://configuration-template/notion/collection/process-runs",
        "process-policy-standards": "soter-fixture://configuration-template/notion/collection/process-policy-standards"
      }
    }
  }
}
